,question,answer1,answer2,label_1,label,Explanation,Answer similarity,sas,f1,bertvanilla,berttrained,bi_encoder,bleu,rouge_L,meteor,answer_encoded_twice
3221,what is a national insurance number in the uk,"""personal account number""",The National Insurance number,2,2,Wrong gold label,,0.036074243,0.333333333,0.500617087,0.365389228,0.326699555,0,0.285714286,0.12195122,The National Insurance number
3230,the dominant trees of the mesozoic era are called,angiosperms,conifers,2,2,Biological term,,0.012679572,0,0.272432297,0.182635114,0.192409873,0,0,0,conifers
3235,what happened to ned starks brother and father,executes,death,2,2,Synonyms ,,0.010393159,0,0.34208706,0.422527343,0.452517092,0,0,0,death
3238,what happened to ned starks brother and father,executes,died,2,2,Synonyms ,,0.009940899,0,0.377379864,0.353172451,0.370627224,0,0,0,died
3398,how many districts are there in the tennessee house of representatives,9,99,2,2,Wrong gold label,,0.015065641,0,0.609761357,0.385642081,0.424800843,0,0,0,99
3434,what is the purpose of a chip in a debit card,control access to a resource,security,2,2,Synonyms ,,0.009537573,0,0.359534889,0.238060027,0.240407586,0,0,0,security
3482,what movie is bring it on the musical based off of,Bring It On,2000 film of the same name,2,2,Different levels of precision,,0.009794063,0,0.348043263,0.085714526,0.062990621,0,0,0,2000 film of the same name
3494,what is the name of lord hanuman son,Macchanu,makardhwaja,2,2,Alias,,0.052735399,0,0.226977974,0.336726427,0.332220703,0,0,0,makardhwaja
3495,what is the name of lord hanuman son,Macchanu,Makaradhwaja,2,2,Alias,,0.012272796,0,0.226843163,0.408110082,0.426007688,0,0,0,Makaradhwaja
3633,who claimed the mississippi river valley for france,Robert de La Salle,Ren\u00e9-Robert Cavelier,2,2,Names,,0.080623053,0,0.319019884,0.315096885,0.288481742,0,0.25,0,Ren√©-Robert Cavelier
3634,who claimed the mississippi river valley for france,Robert de La Salle,rene - robert cavelier,2,2,Alias,,0.171586245,0.285714286,0.424222499,0.303773552,0.300320745,0,0.285714286,0.125,rene - robert cavelier