,Unnamed: 0.1,answer1,answer2,label,berttrained,f1,sas,bertvanilla,bi_encoder
0,0,rotiert,"schwingt bei vertikaler Polarisation der elektrische Feldvektor zwischen oben und unten, bei horizontaler Polarisation zwischen links und rechts",0.0,0.23049260675907135,0.0,0.2232432514429092,0.384092628955841,0.1742291301488876
1,1,in Blautönen gehaltenen Außenwände,Blaues,1.0,0.5877377390861511,0.0,0.5069923996925354,0.5883035659790039,0.5799958109855652
2,2,'Anorthotiko Komma Ergazomenou Laou'',Fortschrittspartei des werktätigen Volkes,2.0,0.058045972138643265,0.0,0.0417545698583126,0.3491891324520111,-0.040064875036478
3,3,aus dem englischen,"von  ‚Geißel‘, ‚Seuche‘ und lat.  ‚töten‘",0.0,0.3274281919002533,0.0,0.1279093623161316,0.4565880000591278,0.2066212743520736
4,4,Ramadan-Monat,sind üblicherweise an den Rändern der Koranexemplare markiert,0.0,0.3178958296775818,0.0,0.1237971857190132,0.4626064002513886,0.2918339669704437
5,5,"denn es ist eine beliebte Praxis, verteilt auf die dreißig Ramadan-Nächte, eine Chatma, also eine Komplettlesung des Korans, vorzunehmen",Sie finden vor allem in der Liturgie Verwendung und dienen als Maßeinheiten zur Festlegung von Gebetspensen,0.0,0.37556952238082886,0.0,0.0458751134574413,0.471070945262909,0.3909680247306824
6,6,an den Rändern der Koranexemplare markiert,Die Grenzen zwischen den einzelnen Dschuzʾ- und Hizb-Abschnitten befinden sich meistens mitten in einer Sure.,0.0,0.3136585056781769,0.1,0.4367769062519073,0.5001361370086671,0.2731170654296875
7,7,bis etwa 1 MHz,niedriger,0.0,0.06573664397001266,0.0,0.2186568677425384,0.345710963010788,-0.0023809550330042
8,8,Nährgebiet,Akkumulationsgebiet,2.0,0.450846403837204,0.0,0.265578955411911,0.3791106939315796,0.4822392463684082
9,9,Zehrgebiet,Ablationsgebiet,2.0,0.42579159140586853,0.0,0.2463489025831222,0.5017355680465698,0.418175220489502
10,10,Funktion eines Prädikativums,fast nur im gehobenen Stil verwendet,0.0,0.2746847867965698,0.0,0.0999037995934486,0.383276641368866,0.2022681683301925
11,11,das lateinische Alphabet in Groß- und Kleinschreibung,ABCDEFGHIJKLMNOPQRSTUVWXYZ,1.0,0.14966031908988953,0.0,0.0549679100513458,0.349416971206665,0.1012589856982231
12,12,"An der Gletschersohle sowie den Flanken eines Gletschers kann das Eis oft am anstehenden Gestein festfrieren, wodurch hier keine Bewegung möglich ist.",Auf molekularer Ebene besteht Eis aus übereinanderliegenden Molekülschichten mit relativ schwachen Bindungskräften zwischen den einzelnen Schichten,0.0,0.4644119143486023,0.1081081081081081,0.3708415627479553,0.4565753936767578,0.4761382341384888
13,13,am Golf von Mexiko in der Golfküstenebene,Südküste,0.0,0.2532966136932373,0.0,0.3024840652942657,0.5489984750747681,0.2158038169145584
14,14,Johads,Johad,2.0,0.7682992815971375,0.0,0.8521178960800171,0.8646899461746216,0.8221288919448853
15,15,die alten traditionellen Methoden des Regenwassersammelns zu dokumentieren und Pilotprojekte aufzubauen,Die Menschen werden jetzt wieder verstärkt in die Wasserversorgung einbezogen,0.0,0.347773939371109,0.0952380952380952,0.3345751166343689,0.5022075176239014,0.3196905553340912
16,16,Sheffield United,Brian Deane,0.0,0.16137883067131042,0.0,0.0708735659718513,0.3901084959506989,0.1542451828718185
17,17,"USA, in Kanada und in Australien (hier nur umgangssprachlich)","in den USA vor allem zum American Football, in Kanada zum Canadian Football und in Australien zum Australian Football",1.0,0.6466575860977173,0.4285714285714285,0.5477564930915833,0.6464542746543884,0.640207052230835
18,18,Baktrien,Afghanistan und Pakistan,0.0,0.11299578845500946,0.0,0.1095199510455131,0.4069781601428985,0.0877971351146698
19,19,Die Anzahl der Einwohner wird in unterschiedlichen Quellen nicht einheitlich angegeben.,"Für das Jahr 2017 wird die Einwohnerzahl bei den Vereinten Nationen mit 5,1 Millionen, im CIA World Factbook mit 5,9 Millionen
und bei Statista mit 6,7 Millionen angegeben",1.0,0.2429976463317871,0.1538461538461538,0.402774304151535,0.5428010821342468,0.1641107499599456
20,20,Im internationalen Vergleich ist die Versorgungsquote mit Verhütungsmitteln in Eritrea schlecht.,nur 7 % der verheirateten Frauen Zugang zu modernen Verhütungsmitteln,1.0,0.30639952421188354,0.1,0.4421506524085999,0.6191198229789734,0.1659851521253585
21,21,Das Betreten – außer zum Be- und Entladen – sowie die Mitfahrt sind verboten.,"Ein Güteraufzug ist nach der bisherigen deutschen Aufzugsverordnung eine Aufzugsanlage, die ausschließlich zum Transport von Gütern ohne die Begleitung von Personen gedacht ist.",1.0,0.4686027765274048,0.1081081081081081,0.3671028316020965,0.524857223033905,0.5035668015480042
22,22,durch die jahrelange öffentliche Abwesenheit,"Für viele Untertanen wurde die „Witwe von Windsor“ („Widow of Windsor“) zu einer etwas wunderlichen Einsiedlerin im Witwenkleid, einer entrückten Gestalt, ehrfurchtgebietend und über ein weltumspannendes Imperium herrschend",0.0,0.06768768280744553,0.0606060606060606,0.3310172855854034,0.4383783340454101,-0.0068829106166958
23,23,-lijer,op,0.0,0.423265278339386,0.0,0.2459391355514526,0.4116208553314209,0.4658680856227875
24,24,Neben Krankheiten basiert der pejorative Wortschatz vor allem auf Geschlechtsteilen und Sexualität.,Krankheiten,1.0,0.3567599058151245,0.1538461538461538,0.3120727241039276,0.5782455205917358,0.3371913731098175
25,25,500 MB/s,5 Gbit/s,0.0,0.5662476420402527,0.0,0.2178570330142974,0.6677072644233704,0.5678842067718506
26,26,23 Uhr,23.00 Uhr,2.0,0.9038873314857483,0.5,0.7861263155937195,0.9008858799934388,0.9293213486671448
27,27,„Last Order“,eine Glocke,0.0,0.18803657591342926,0.0,0.0679830387234687,0.4986930787563324,0.1909813284873962
28,28,1897,23. September 1896,0.0,0.5227436423301697,0.0,0.2562076449394226,0.6806877851486206,0.5532206892967224
29,29,"Indianerstämmen der Muskogee, der Seminolen, der Cherokee, der Choctaw und der Chickasaw zu (den „Fünf zivilisierten Nationen“), die aus den östlichen Staaten vertrieben wurden. Etwa 50.000 Menschen wurden nach Oklahoma getrieben, wo sie auf bereits ansässige andere Indianerstämme trafen.",Umsiedlung,1.0,0.3844684362411499,0.0,0.318958431482315,0.3931271731853485,0.3606145977973938
30,30,Großer Schneesturm,wegen eines Unwetters,1.0,0.3226907551288605,0.0,0.3270385861396789,0.4727484285831451,0.2884357571601868
31,31,Nationalstaatsidee,einem vereinten deutschen Staat,1.0,0.3731987774372101,0.0,0.3523668646812439,0.4628446698188782,0.3431785702705383
32,32,Pädagogen Friedrich Fröbel,Fröbel,2.0,0.6612228155136108,0.5,0.7016562223434448,0.7728303074836731,0.6621343493461609
33,33,Meyers Konversations-Lexikon,Brockhaus Enzyklopädie,0.0,0.2660122215747833,0.0,0.5967026948928833,0.4200862050056457,0.2169774919748306
34,34,für höhere Organismen nur relativ schwach giftig,"So kann ein Mensch täglich 0,04 Gramm Kupfer zu sich nehmen, ohne Schaden an seiner Gesundheit zu erleiden",1.0,0.21434926986694336,0.0,0.1802637577056884,0.392916589975357,0.1583337634801864
35,35,unter 2 %,"nahe, aber unter 2 %",2.0,0.7950205206871033,0.6666666666666666,0.8421996235847473,0.8218407630920409,0.8098882436752319
36,36,vis viva,lebendigen Kräfte,2.0,0.496273398399353,0.0,0.2374069988727569,0.3818831443786621,0.4540885984897614
37,37,Behandlung der elastischen Deformation,Lösung der Bewegungsgleichungen vor allem in der Himmelsmechanik,0.0,0.30972805619239807,0.1666666666666666,0.1003224328160286,0.4596480131149292,0.2917257249355316
38,38,das Funktionsprinzip der Dampfmaschine,"Der Physiker Nicolas Carnot erkannte, dass beim Verrichten von mechanischer Arbeit eine Volumenänderung des Dampfs nötig ist. Außerdem fand er heraus, dass die Abkühlung des heißen Wassers in der Dampfmaschine nicht nur durch Wärmeleitung erfolgt",1.0,0.5493389368057251,0.1025641025641025,0.4130518734455109,0.5571054220199585,0.5407041907310486
39,39,Thayendanegea,Joseph Brant,2.0,0.2214183509349823,0.0,0.0279418602585792,0.3610248267650604,0.2282657623291016
40,40,die junge weiße Frau Mayella vergewaltigt zu haben,Vergewaltigung,1.0,0.44699791073799133,0.0,0.5312483906745911,0.5016919374465942,0.3961645364761353
41,41,der Verurteilte wird kurz nach dem Prozess bei einem Fluchtversuch erschossen,Am Ende des Romans begleitet Scout ihren Nachbarn Boo wieder zurück in sein Haus,0.0,0.12330617010593414,0.0,0.0285826753824949,0.4170540869235992,0.0840913951396942
42,42,"veredelte, geschmückte und verzierte, oft aufwendig bearbeitete Papiererzeugnisse die von etwa 1820/1860 bis 1920/1930 hergestellt wurden, als es eine eigene Luxuspapierindustrie gab","Andachts- und Fleißbildchen, viele Ansichts- (Leporello), Gelegenheits- (Glückwunsch-, Weihnachts- und Neujahrskarten) und Bildpostkarten (Motivkarten), verzierte Briefbogen, Etiketten, allerlei Papierspielzeug (Papiertheater), Reklamemarken und Sammelbilder und vieles mehr",0.0,0.3904811143875122,0.0833333333333333,0.5294197201728821,0.4969480931758881,0.3555189669132233
43,43,Die Partei der Demokratischen Revolution,Movimiento Progresista,1.0,0.48240888118743896,0.0,0.2429572641849517,0.374481737613678,0.5114433765411377
44,44,"Die Sprachwahl war, neben den stilisierbaren Protagonisten des „Wettrennens ins All“, den „Helden“, einer der Gründe für die Popularität der Raumfahrt in den 60ern. Durch diese Sprachwahl konnte ein breiteres Publikum angesprochen werden, ein hochpolitisches Thema wurde für breite Massen dadurch „lesbar“, beziehungsweise damit aufbereitet.",Politik und Medien glorifizierten in den 1960ern das Ringen um kosmische Überlegenheit und allgemeine Begeisterung für den Schauplatz und seine Akteure,2.0,0.47602400183677673,0.1212121212121212,0.6162370443344116,0.4978551864624024,0.5041090250015259
45,45,Das objektive Jagdrecht,Jagdrecht,2.0,0.7923817038536072,0.5,0.6625402569770813,0.7508417963981628,0.7828754782676697
46,46,Generell bilden Regelungen zum rechtlichen Status des Wildes und zum Inhaber des subjektiven Jagdrechts,Frankfurter Reichsverfassung vom 28. März 1849,0.0,0.1339714527130127,0.0,0.0648916587233543,0.4360501170158386,0.0660340338945388
47,47,weitergehende Regelungen,"z. B. Restriktionen zu den jagdbaren Wildarten, Jagd- und Schonzeiten für das jagdbare Wild, Verbote bestimmter Jagdwaffen und -methoden, Voraussetzungen für Ausstellung eines Jagdscheins, Meldepflichten für erlegtes Wild, Vorschriften zum Umgang mit Wildbret und zahlenmäßige oder qualitative Begrenzungen beim Erlegen von jagdbaren Wild",1.0,0.4064803123474121,0.0,0.5016377568244934,0.414132297039032,0.3257696032524109
48,48,"Zum einen können die Genprodukte der Chromosomen direkt in den Zellen wirken, in denen sie exprimiert werden. Zum anderen bedingen die Gonosomen die Entwicklung der Gonaden, die die Geschlechtshormone bilden.","Geschlechtshormone, wie Testosteron und die Östrogene, wirken nicht nur auf die Keimdrüsen, sondern in vielfältiger Weise auf das gesamte Nervensystem: auf Nervenzellen, Synapsen, Genexpression",0.0,0.6587672233581543,0.1851851851851852,0.5311794281005859,0.6112768650054932,0.6918614506721497
49,49,die NATO,syrischen Geheimdienst,0.0,0.30125564336776733,0.0,0.089538924396038,0.5016201734542847,0.3464708626270294
50,50,Nintendo Advanced Video System,Famicom,0.0,0.158310666680336,0.0,0.1712323129177093,0.3347146809101105,0.1624450981616974
51,51,"Bei Allergien, auch als Überempfindlichkeitsreaktion bezeichnet",so genannten Autoimmunerkrankungen,1.0,0.4293593764305115,0.0,0.323746919631958,0.3903844058513641,0.3702099919319153
52,52,"Der Berstwiderstand gibt den benötigten Druck an, um ein Papier zum Bersten zu bringen.","Druck, der zum Durchstoßen des Papiers erforderlich ist",2.0,0.709382951259613,0.2857142857142857,0.8259740471839905,0.6096182465553284,0.7435668110847473
53,53,das Fehlen des vokalisierten «L»,die Übernahme einiger Wörter aus dem früheren Unterschichtsquartier Matte,0.0,0.19017566740512848,0.0,0.1421442776918411,0.4408275783061981,0.1511435508728027
54,54,am 24. November 1859,1859,1.0,0.7885786294937134,0.4,0.5889602303504944,0.7253018617630005,0.7860342264175415
55,55,derjenigen anderer früher indogermanischer Völker ähnlich,"In den Naturerscheinungen, besonders den Phänomenen des Himmels, sahen die Slawen wirkliche Wesen, die sie sich mit Denken und Empfinden ausgestattet vorstellten, einige wohltätig, andere zerstörend wirkend",0.0,0.26172640919685364,0.0,0.2042796462774276,0.4011175334453583,0.2314730584621429
56,56,bog,"Svarog (der ''Schöpfer''), als Urheber des Donners heißt er Perun (balt. ''Perkunas'')",0.0,0.21816590428352356,0.0,0.1710054278373718,0.4692647755146026,0.167291909456253
57,57,Erich Wolfgang Skwara,Raoul Schrott,0.0,0.41836118698120117,0.0,0.1387114375829696,0.3325916826725006,0.4340288341045379
58,58,"Friedrich II. die österreichische Provinz Schlesien erobert und versuchte, sie mittels eines Bündnissystems gegen eine mögliche Rückeroberung zu behaupten.
* Österreich unter Mar",den preußischen König Friedrich II. (1712–1786) außenpolitisch zu isolieren,0.0,0.34961339831352234,0.1935483870967742,0.4140476882457733,0.5198708772659302,0.3641755282878876
59,59,die zahlreichen Brunnen in der Stadt rund um den See,dieser künstliche See mit Namen Gadisar,0.0,0.4238658845424652,0.125,0.2808182537555694,0.4963535070419312,0.4207432270050049
60,60,"die Hauptgruppen sind: die Einsicht in die Lehre, ihre ethischen Grundlagen und die Schwerpunkte des geistigen Trainings (Meditation/Achtsamkeit)",dreigeteilt,1.0,0.13320545852184296,0.0,0.0950973406434059,0.4046026170253753,0.0480994768440723
61,61,"da im Gegensatz zu anderen Materialien bei Blei keine Wirkschwelle benannt werden kann, unter der die Aufnahme von Blei gesundheitlich unbedenklich ist.",aus Gründen des Umweltschutzes (siehe Bleibelastung der Umwelt) und gesundheitlichen Gründen (siehe Bleivergiftung),1.0,0.5261311531066895,0.0571428571428571,0.5695198178291321,0.5158802270889282,0.5100024342536926
62,62,vorzugsweise bei Sendern hoher Leistung,bei großen hochfrequenten Strömen und Spannungen im Kilovolt-Bereich,0.0,0.5472865700721741,0.1538461538461538,0.4057726562023163,0.4813556671142578,0.5267248749732971
63,63,bei großen hochfrequenten Strömen und Spannungen im Kilovolt-Bereich,vorzugsweise bei Sendern hoher Leistung,0.0,0.5472865700721741,0.1538461538461538,0.3906343877315521,0.4813556671142578,0.5267248749732971
64,64,51. Bundesstaat,Democrats Abroad,0.0,0.15826185047626495,0.0,0.1002264767885208,0.4309549331665039,0.1474189758300781
65,65,"die dann unter der Bezeichnung „Rationalismus“ zusammengefasst werden. Diese Positionierung dient vor allem der Distanzierung des Empirismus von traditionellen, scholastisch-rationalistischen Auffassungen.
Diese Auffassungen gehen davon aus, dass Weltwissen auch aus reinem Denken möglich ist oder dieses reine Denken sogar die primäre oder ausschließliche Erkenntnisquelle ausmache.",Rationalismus,1.0,0.42314624786376953,0.0,0.530964195728302,0.5717628002166748,0.3747745156288147
66,66,"Unter Einhaltung dieser Bedingungen weicht sie möglichst wenig von der örtlichen Sonnenzeit ab. Die Differenz zwischen der örtlichen Sonnenzeit und der Zonenzeit eines Ortes ist östlich des Mittelmeridians negativ und westlich davon positiv, und sofern die Grenzen der Zeitzonen in etwa mit ihrer natürlichen Lage übereinstimmen – was heute oft nicht mehr zutrifft –, ist der Betrag dieser Differenz im Jahresmittel nirgends wesentlich größer als eine halbe Stunde.",Die Sommerzeit ist damit gleich der Zonenzeit der östlich benachbarten Zeitzone,1.0,0.5502324104309082,0.1518987341772152,0.4435476362705231,0.6032732129096985,0.5558188557624817
67,67,die Zonenzeit in der Mitteleuropäischen Zeitzone mit dem Bezugsmeridian der geographischen Länge 15° Ost,die Mitteleuropäische Zeit,2.0,0.4997098743915558,0.1176470588235294,0.7305824160575867,0.641183614730835,0.4143475592136383
68,68,"eingeschleppte Krankheiten, Strafexpeditionen, Umsiedlungen und Zwangsarbeit",Krankheiten,1.0,0.35379308462142944,0.2857142857142857,0.3986989259719849,0.5797321796417236,0.318726122379303
69,69,Downtown Houston,Houston,1.0,0.860406219959259,0.6666666666666666,0.7115951180458069,0.6089031100273132,0.8602398633956909
70,70,Gewaltenteilung,die fehlende Trennung zwischen Exekutive (ausübende) und Legislative (gesetzgebende Gewalt),2.0,0.496030330657959,0.0,0.4971066415309906,0.4316609799861908,0.5237684845924377
71,71,Eine anhaltende erhöhte Zinkzufuhr kann zu Kupfermangel und Störungen in der Blutbildung führen.,"ab 200 mg können Symptome wie Übelkeit, Erbrechen oder auch Durchfall auftreten. Beim Menschen führt die Aufnahme von Zink ab etwa 2 g zu akuten Vergiftungserscheinungen",1.0,0.4980183243751526,0.0512820512820512,0.4313510954380035,0.5229090452194214,0.4361326396465301
72,72,Außenrufe und Innenkommandos,Eingabe eines Fahrtwunsches über die Außentableaus (Ruf) oder vom Kabinentableau (Kommando),2.0,0.565843403339386,0.0,0.66000896692276,0.5509670376777649,0.5584980249404907
73,73,einer ca. 200.000 Jahre alten Fundstelle aus der Zeit des Neandertalers an einem ehemaligen Seeufer bei Frankleben in Sachsen-Anhalt,Hinweis auf das Gerben von Tierhäuten,0.0,0.2835468351840973,0.0,0.0645383074879646,0.4138998091220856,0.1705564558506012
74,74,Die Effektivität als Kleidung wurde durch die Erfindung des Nähens erheblich gesteigert,da Kleidung nun geschlossen und dem menschlichen Körperbau angepasst werden konnte,0.0,0.46210360527038574,0.0869565217391304,0.5047837495803833,0.4865071475505829,0.460835337638855
75,75,Haus Oranien,von Oranien,2.0,0.778107762336731,0.5,0.6728819608688354,0.8070505261421204,0.8045037984848022
76,76,"dass sich der Vater, als er bei der Meldung der Geburt zurückrechnete, eine Woche zu viel zählte und fälschlicherweise den 22. Februar als Geburtstag seines Sohnes eintragen ließ","Die beiden Urkunden verzeichnen als Geburtsdatum den 22. Februar 1810, aber sowohl Chopin als auch seine Mutter gaben als Geburtstag den 1. März 1810 an",0.0,0.5575963854789734,0.2307692307692307,0.4652686715126038,0.5928146839141846,0.5433583855628967
77,77,durch Schlafmangel und Dehydrierung ausgelösten temporären Psychose,wegen eines Nervenzusammenbruchs,1.0,0.46119025349617004,0.0,0.2750480473041534,0.4098696708679199,0.4679713249206543
78,78,etwas über einer Million Einwohnern,659.433 Einwohnern (2009),0.0,0.16963450610637665,0.25,0.3225673139095306,0.5365516543388367,0.0653333589434623
79,79,acht,acht Stadtbezirke,2.0,0.6965609192848206,0.6666666666666666,0.606830894947052,0.7534583210945129,0.6858015656471252
80,80,Eklogen,''Eklogen'' oder ''Bucolica'',1.0,0.5479220151901245,0.5,0.5800716876983643,0.6339291334152222,0.5311672687530518
81,81,"nur bis eine Gigawattstunde pro Jahr die EEG-Umlage in voller Höhe berechnet. Für den Energieanteil zwischen einer und 10 Gigawattstunden sind 10 % der EEG-Umlage zu bezahlen, zwischen 10 und 100 Gigawattstunden nur noch 1 % der EEG-Umlage.","Die Deutsche Bahn AG sah sich bei deren Umsetzung mit Mehrausgaben von jährlich 500 Millionen Euro belastet, von denen 137 Millionen Euro durch den möglichen Entfall der geminderten EEG-Umlage entstehen würden und 350 Millionen Euro durch die mögliche Einführung der EEG-Umlage für selbsterzeugten Strom",0.0,0.4836786389350891,0.2,0.3625709414482117,0.5786679983139038,0.4175103902816773
82,82,"Männer, denen das Wahlrecht zustand, waren automatisch registriert, Frauen mussten einen besonderen Antrag stellen, um ihre politischen Rechte ausüben zu können","Für Männer bestand Wahlpflicht, für Frauen nicht",0.0,0.5469032526016235,0.1428571428571428,0.467729777097702,0.5856885313987732,0.5143439173698425
83,83,muslimische Gemeinden,"Kimbanguisten, sowie neuapostolische Christen",0.0,0.17771968245506287,0.0,0.1458771675825119,0.4311921894550324,0.1507455110549926
84,84,"Im Gegensatz zu den meisten anderen Religionen und zum Synkretismus führte der wachsende Ausschließlichkeitsanspruch des Christentums zur Verweigerung gegenüber dem Kaiserkult und damit der römischen Autorität,","Dies führte zu Maßnahmen gegen die beiden Religionen, die mit dem Polytheismus unvereinbar zu sein schienen",0.0,0.47869646549224854,0.1904761904761905,0.3350213766098022,0.553818941116333,0.4640059769153595
85,85,313 n. Chr.,311 n. Chr.,0.0,0.8492916226387024,0.6666666666666666,0.4462697803974152,0.9615815877914428,0.8424123525619507
86,86,da diese immer nur einen Einzelfall repräsentierten,"Klassischerweise schränken viele Empiristen die intuitiv-deduktive Form des Wissens auf die Verhältnisse zwischen den Begriffen ein, die bestenfalls die Operationen des eigenen Verstandes repräsentieren",0.0,0.25494831800460815,0.0,0.2453690320253372,0.4450585246086121,0.1839151680469513
87,87,durch das Metrum,die Schwingung selbst und jede denkbare praktische Involvierung,0.0,0.30806809663772583,0.0,0.1931488066911697,0.4550250470638275,0.257281482219696
88,88,als elementare Voraussetzung der Musik,Musik ist von den Künsten der Zeit am nächsten,0.0,0.5109453797340393,0.2857142857142857,0.4186878204345703,0.5451595187187195,0.4722965955734253
89,89,besonders flüchtig,Medium in der Zeit,0.0,0.31293585896492004,0.0,0.2182586789131164,0.3993967175483704,0.2696243226528168
90,90,Goring House,Buckinghams Haus,2.0,0.36500653624534607,0.0,0.2916310429573059,0.442882090806961,0.3534085750579834
91,91,1703,etwa 1633,0.0,0.45083796977996826,0.0,0.2911072075366974,0.7603589296340942,0.4460536241531372
92,92,nach seinem Kurzfilm ''Amblin'',Amblin Entertainment,0.0,0.5868728160858154,0.3333333333333333,0.5574025511741638,0.6291543245315552,0.5662755966186523
93,93,16. Dezember 2015,1982,0.0,0.12315766513347626,0.0,0.047075193375349,0.5281572341918945,0.1543067246675491
94,94,Anthony Porter,Porter,1.0,0.7328138947486877,0.6666666666666666,0.8472438454627991,0.8329391479492188,0.7318539619445801
95,95,die klassische Periode der japanischen Literatur,"Am Hof von Heian wurden die japanische Kultur, Kunst und Sitten zu außerordentlicher Verfeinerung geführt",0.0,0.3718394935131073,0.0952380952380952,0.3335282206535339,0.5308896899223328,0.3477636277675629
96,96,Hiragana,onna-de,0.0,0.2815907597541809,0.0,0.1239854842424392,0.3929043710231781,0.3007577061653137
97,97,Familie Fujiwara,Fujiwara-Familie,2.0,0.927122950553894,0.0,0.9604458212852478,0.9539061784744264,0.9510939121246338
98,98,durch ihre geschickte Heiratspolitik,der vier seiner Töchter an Kaiser verheiratete,1.0,0.30894264578819275,0.0,0.4085425734519959,0.5161025524139404,0.2145536094903946
99,99,die ''Genji'' (''Minamoto'') und die ''Heike'' (''Taira''),"als die Taira ihre Macht durch Einheirat in die kaiserliche Familie etabliert hatten, erhoben sich die Genji wieder und der ''Gempei-Krieg'' entbrannte",1.0,0.4342096149921417,0.3448275862068965,0.4099074602127075,0.6432213187217712,0.4201734066009521
100,100,Klan der Taira,Taira,2.0,0.805597722530365,0.5,0.7217500805854797,0.8062153458595276,0.8035863637924194
101,101,Point after Touchdown,Field Goal,1.0,0.37541723251342773,0.0,0.4012407660484314,0.3389990925788879,0.4032649993896485
102,102,ASPTT Strasbourg,Racing Straßburg,0.0,0.7692643404006958,0.0,0.3981735110282898,0.353869765996933,0.7871526479721069
103,103,"Jung-, Spät- und Endneolithikum",Beginn der Metallverarbeitung im Schmelzverfahren,0.0,0.24213282763957977,0.0,0.1136739626526832,0.4584195017814636,0.2204084545373916
104,104,Der kanadische Premierminister,Brian Mulroney,1.0,0.1436314731836319,0.0,0.1242815107107162,0.4264641404151917,0.1346834301948547
105,105,den Nobelpreis für Physiologie oder Medizin,die Gewinnung monoklonaler Antikörper,0.0,0.28950220346450806,0.0,0.1138541027903556,0.4061403572559357,0.2384094297885895
106,106,Graphitrohr-AAS,Polarographie,0.0,0.15837863087654114,0.0,0.1431821584701538,0.4002337455749512,0.1370888948440551
107,107,Allen Welsh Dulles,"Dulles, der zwischen 1953 und 1961 als Direktor der CIA fungierte, war neben George Tenet am längsten an der Spitze der amerikanischen Auslandsspionage",1.0,0.2886900007724762,0.08,0.5180096030235289,0.5321319699287415,0.2341930568218231
108,108,von Parlamentariern,Einflussreiche Bürger,1.0,0.31336185336112976,0.0,0.2589947879314422,0.4070674777030945,0.3077272474765777
109,109,Ramon Llull,Grafen von Barcelona und des nachfolgenden katalanisch-aragonesischen Staatenbunds,0.0,0.09723906219005585,0.0,0.1842212080955505,0.3712904751300812,0.0427185297012329
110,110,"Weitere beliebte Insekten der Terrarianer sind Stabheuschrecken, Fangschrecken und verschiedene Käfer- und Schabenarten, außerdem werden Mehlkäferlarven (Mehlwürmer), Grillen und andere Insekten als Futtertiere für Reptilien und andere Heimtiere sowie als Angelköder gezüchtet. Eine Entwicklung der letzten Jahrzehnte ist die Haltung von Schmetterlingen in großen Gewächshäusern, die als Schmetterlingshäuser für Besucher geöffnet werden und an manchen Orten zu den Sehenswürdigkeiten der Region werden.","die Ameisen,",0.0,0.38955157995224,0.0317460317460317,0.3337615430355072,0.4820556044578552,0.342323362827301
111,111,„Reflexionen“,Reflections on the Revolution in France,1.0,0.4368436932563782,0.0,0.3491333723068237,0.4240822196006775,0.3838114738464356
112,112,"eine scharfe Kritik an den damals in Frankreich nach der Revolution von 1789 herrschenden Zuständen und Entwicklungen, die schließlich in der Terrorherrschaft der Jakobiner 1793/1794 mündeten.",Revolution in Frankreich,1.0,0.4882311224937439,0.2142857142857142,0.4058238863945007,0.6147140860557556,0.4391518831253052
113,113,Milladoiro oder Fuxan os Ventos,Milladoiro,1.0,0.5031532645225525,0.3333333333333333,0.4788402020931244,0.7130159735679626,0.4342637062072754
